{
  "id": "juros-compostos",
  "slug": "/calculadora-juros-compostos",
  "title": "Calculadora de Juros Compostos",
  "description": "Montante com capitalização composta.",
  "category": "financeira",
  "norms": ["Matemática Financeira"],
  "formulaType": "juros-compostos",
  "inputs": [
    { "id": "principal", "label": "Capital (R$)", "type": "currency", "default": 1000, "min": 0 },
    { "id": "rate", "label": "Taxa mensal (%)", "type": "percent", "default": 1, "min": 0, "step": 0.01 },
    { "id": "periods", "label": "Períodos (meses)", "type": "number", "default": 12, "min": 1 }
  ],
  "outputs": [
    { "id": "total", "label": "Montante", "format": "currency" },
    { "id": "interest", "label": "Juros acumulados", "format": "currency" }
  ]
}
